title,n_enrolled,course_type,institution,Level,subject,language,subtitles,course_effort,course_length,price_numeric
How to Learn Online,124980,Self-paced on your time,edX,Introductory,Education & Teacher Training,English,English,2–3 hours per week,2 Weeks,49.0
Programming for Everybody (Getting Started with Python),293864,Self-paced on your time,The University of Michigan,Introductory,Computer Science,English,English,2–4 hours per week,7 Weeks,49.0
CS50's Introduction to Computer Science,2442271,Self-paced on your time,Harvard University,Introductory,Computer Science,English,English,6–18 hours per week,12 Weeks,90.0
The Analytics Edge,129555,Instructor-led on a course schedule,Massachusetts Institute of Technology,Intermediate,Data Analysis & Statistics,English,English,10–15 hours per week,13 Weeks,199.0
Marketing Analytics: Marketing Measurement Strategy,81140,Self-paced on your time,"University of California, Berkeley",Introductory,Computer Science,English,English,5–7 hours per week,4 Weeks,249.0
Introduction to Project Management,301793,Self-paced on your time,University of Adelaide,Introductory,Business & Management,English,English,2–3 hours per week,6 Weeks,199.0
Leading High-Performing Teams,32847,Self-paced on your time,The University of Queensland,Intermediate,Communication,English,English,8–10 hours per week,10 Weeks,5.0
The Foundations of Happiness at Work,67073,Self-paced on your time,"University of California, Berkeley",Introductory,Business & Management,English,English,2–3 hours per week,4 Weeks,199.0
"Managing Study, Stress and Mental Health at University",23061,Self-paced on your time,Curtin University,Introductory,Health & Safety,English,English,1–3 hours per week,2 Weeks,49.0
Six Sigma: Define and Measure,92411,Self-paced on your time,Technische Universität München,Introductory,Business & Management,English,English,3–4 hours per week,8 Weeks,99.0
Fat Chance: Probability from the Ground Up,66835,Self-paced on your time,Harvard University,Introductory,Math,English,English,3–5 hours per week,7 Weeks,49.0
Chasing your Dream: How to End Procrastination and Get a Job You Love,44711,Self-paced on your time,National Research Nuclear University,Introductory,Communication,English,English,2–6 hours per week,5 Weeks,49.0
Bitcoin and Cryptocurrencies,83398,Self-paced on your time,"University of California, Berkeley",Introductory,Computer Science,English,English,3–5 hours per week,6 Weeks,99.0
English Grammar and Style,0,Instructor-led on a course schedule,The University of Queensland,Introductory,Humanities,English,English,3–4 hours per week,8 Weeks,99.0
Ethics in Action,6366,Self-paced on your time,SDG Academy,Intermediate,Ethics,English,"English, Español, Русский",2–4 hours per week,10 Weeks,49.0
Introduction to FinTech,72767,Self-paced on your time,University of Hong Kong,Introductory,Economics & Finance,English,"English, 中文, 中文",1–3 hours per week,6 Weeks,199.0
Data Science: R Basics,528782,Self-paced on your time,Harvard University,Introductory,Data Analysis & Statistics,English,English,1–2 hours per week,8 Weeks,49.0
Python Basics for Data Science,228809,Self-paced on your time,IBM,Introductory,Data Analysis & Statistics,English,English,2–5 hours per week,5 Weeks,39.0
The Science of Beer,39085,Self-paced on your time,Wageningen University & Research,Introductory,Food & Nutrition,English,English,2–4 hours per week,6 Weeks,49.0
Strategic Social Media Marketing,103640,Instructor-led on a course schedule,Boston University,Advanced,Business & Management,English,English,4–6 hours per week,6 Weeks,399.0
CS50's Introduction to Artificial Intelligence with Python,258006,Self-paced on your time,Harvard University,Introductory,Computer Science,English,English,10–30 hours per week,7 Weeks,199.0
CS50's Introduction to Game Development,346748,Self-paced on your time,Harvard University,Intermediate,Computer Science,English,English,6–9 hours per week,12 Weeks,149.0
Rhetoric: The Art of Persuasive Writing and Public Speaking,320225,Self-paced on your time,Harvard University,Introductory,Humanities,English,English,2–3 hours per week,8 Weeks,99.0
CS50's Web Programming with Python and JavaScript,698950,Self-paced on your time,Harvard University,Intermediate,Computer Science,English,English,6–9 hours per week,12 Weeks,90.0
Contract Law: From Trust to Promise to Contract,414181,Self-paced on your time,Harvard University,Intermediate,Business & Management,English,English,3–6 hours per week,8 Weeks,125.0
"Fundamentals of Neuroscience, Part 1: The Electrical Properties of the Neuron",380167,Self-paced on your time,Harvard University,Introductory,Biology & Life Sciences,English,English,3–5 hours per week,5 Weeks,99.0
Justice,392588,Self-paced on your time,Harvard University,Introductory,Humanities,English,"Deutsch, English, Español, Português, 中文",3–6 hours per week,12 Weeks,99.0
Data Science: Machine Learning,276209,Self-paced on your time,Harvard University,Introductory,Data Analysis & Statistics,English,English,2–4 hours per week,8 Weeks,49.0
Child Protection: Children's Rights in Theory and Practice,212453,Self-paced on your time,Harvard University,Introductory,Social Sciences,English,English,2–6 hours per week,16 Weeks,99.0
IELTS Academic Test Preparation,1103777,Self-paced on your time,The University of Queensland,Introductory,Communication,English,English,5–10 hours per week,8 Weeks,99.0
The Architectural Imagination,406181,Self-paced on your time,Harvard University,Introductory,Architecture,English,English,3–5 hours per week,10 Weeks,99.0
TOEFL® Test Preparation: The Insider’s Guide,1022489,Self-paced on your time,Educational Testing Service,Introductory,Communication,English,English,2–4 hours per week,6 Weeks,49.0
Principles of Biochemistry,257600,Self-paced on your time,Harvard University,Intermediate,Medicine,English,English,4–6 hours per week,15 Weeks,199.0
Using Python for Research,262183,Self-paced on your time,Harvard University,Intermediate,Computer Science,English,English,2–4 hours per week,12 Weeks,99.0
Hinduism Through Its Scriptures,140782,Self-paced on your time,Harvard University,Introductory,Humanities,English,English,5–10 hours per week,4 Weeks,99.0
Basic Spanish 1: Getting Started,400169,Self-paced on your time,Universitat Politècnica de Valencia,Introductory,Communication,English,"English, Español",4–5 hours per week,7 Weeks,40.0
The Health Effects of Climate Change,110024,Self-paced on your time,Harvard University,Introductory,Environmental Studies,English,English,3–5 hours per week,7 Weeks,99.0
Inglés básico: conversacional y networking,79671,Self-paced on your time,Universidades Anáhuac,Introductory,Business & Management,Español,"English, Español",5–8 hours per week,4 Weeks,49.0
Statistics and R,314586,Self-paced on your time,Harvard University,Intermediate,Data Analysis & Statistics,English,English,2–4 hours per week,4 Weeks,249.0
Science & Cooking: From Haute Cuisine to Soft Matter Science (chemistry),145011,Self-paced on your time,Harvard University,Introductory,Chemistry,English,English,2–3 hours per week,16 Weeks,199.0
Pyramids of Giza: Ancient Egyptian Art and Archaeology,123870,Self-paced on your time,Harvard University,Introductory,Art & Culture,English,English,2–4 hours per week,8 Weeks,99.0
"PredictionX: Omens, Oracles & Prophecies",91566,Self-paced on your time,Harvard University,Introductory,Social Sciences,English,English,3–5 hours per week,1 Weeks,25.0
Excel: Fundamentos y herramientas,284279,Self-paced on your time,Universitat Politècnica de Valencia,Introductory,Computer Science,Español,Español,3–4 hours per week,8 Weeks,50.0
Lessons from Ebola: Preventing the Next Pandemic,91983,Self-paced on your time,Harvard University,Introductory,Social Sciences,English,English,3–5 hours per week,4 Weeks,49.0
Improving Global Health: Focusing on Quality and Safety,127353,Self-paced on your time,Harvard University,Intermediate,Social Sciences,English,English,2–4 hours per week,10 Weeks,99.0
CS50 for Lawyers,87336,Self-paced on your time,Harvard University,Introductory,Computer Science,English,English,3–6 hours per week,10 Weeks,99.0
Data Science: Visualization,171258,Self-paced on your time,Harvard University,Introductory,Data Analysis & Statistics,English,English,1–2 hours per week,8 Weeks,49.0
Christianity Through Its Scriptures,125051,Self-paced on your time,Harvard University,Introductory,Humanities,English,English,5–10 hours per week,4 Weeks,99.0
The Science of Happiness,475614,Self-paced on your time,"University of California, Berkeley",Introductory,Social Sciences,English,English,4–5 hours per week,11 Weeks,169.0
Leaders of Learning,231131,Self-paced on your time,Harvard University,Introductory,Communication,English,"English, Español",2–4 hours per week,10 Weeks,99.0
Exercising Leadership: Foundational Principles,57814,Self-paced on your time,Harvard University,Introductory,Business & Management,English,English,2–3 hours per week,4 Weeks,99.0
Data Science: Probability,135859,Self-paced on your time,Harvard University,Introductory,Data Analysis & Statistics,English,English,1–2 hours per week,8 Weeks,49.0
Introduction to Data Wise: A Collaborative Process to Improve Learning & Teaching,117410,Self-paced on your time,Harvard University,Intermediate,Education & Teacher Training,English,"English, Español",1–2 hours per week,10 Weeks,70.0
"Prescription Drug Regulation, Cost, and Access: Current Controversies in Context",80082,Self-paced on your time,Harvard University,Introductory,Medicine,English,English,2–5 hours per week,8 Weeks,99.0
Introduction to Family Engagement in Education,105146,Self-paced on your time,Harvard University,Introductory,Education & Teacher Training,English,English,2–4 hours per week,6 Weeks,70.0
Italian Language and Culture: Beginner (2019-2020),182462,Self-paced on your time,Wellesley College,Introductory,Language,Italiano,Italiano,2–5 hours per week,12 Weeks,49.0
Steps in Japanese for Beginners1 Part1,53630,Self-paced on your time,Waseda University,Introductory,Language,English,"English, 日本語",3–5 hours per week,5 Weeks,49.0
How to Write an Essay,306787,Self-paced on your time,"University of California, Berkeley",Introductory,Humanities,English,English,5–6 hours per week,5 Weeks,49.0
Energy Within Environmental Constraints,95324,Self-paced on your time,Harvard University,Introductory,Environmental Studies,English,English,3–5 hours per week,10 Weeks,99.0
Introduction to Probability,97291,Self-paced on your time,Harvard University,Intermediate,Data Analysis & Statistics,English,English,5–10 hours per week,10 Weeks,99.0
AnatomyX: Musculoskeletal Cases,102075,Self-paced on your time,Harvard University,Intermediate,Medicine,English,English,3–6 hours per week,7 Weeks,99.0
Data Science: Inference and Modeling,88256,Self-paced on your time,Harvard University,Introductory,Data Analysis & Statistics,English,English,1–2 hours per week,8 Weeks,49.0
Strengthening Community Health Worker Programs,58626,Self-paced on your time,Harvard University,Introductory,Health & Safety,English,English,2–4 hours per week,6 Weeks,79.0
Buddhism Through Its Scriptures,182295,Self-paced on your time,Harvard University,Introductory,Humanities,English,English,5–10 hours per week,4 Weeks,99.0
Introduction to Linux,642088,Self-paced on your time,The Linux Foundation,Introductory,Computer Science,English,English,5–7 hours per week,14 Weeks,199.0
"Bioethics: The Law, Medicine, and Ethics of Reproductive Technologies and Genetics",81221,Self-paced on your time,Harvard University,Introductory,Medicine,English,English,1–2 hours per week,10 Weeks,99.0
Shakespeare's Life and Work,48938,Self-paced on your time,Harvard University,Introductory,Humanities,English,English,5–7 hours per week,4 Weeks,49.0
Marketing Digital: Content & Community Manager,112623,Self-paced on your time,Universidad Galileo,Introductory,Communication,Español,Español,3–4 hours per week,5 Weeks,49.0
Accounting and Finance,88243,Self-paced on your time,Indian Institute of Management Bangalore,Intermediate,Business & Management,English,"English, हिन्दी",2–4 hours per week,11 Weeks,150.0
Computing in Python I: Fundamentals and Procedural Programming,141966,Self-paced on your time,The Georgia Institute of Technology,Introductory,Computer Science,English,English,9–10 hours per week,5 Weeks,99.0
"Nutrition, Exercise and Sports",51679,Self-paced on your time,Wageningen University & Research,Intermediate,Food & Nutrition,English,English,4–8 hours per week,6 Weeks,49.0
Becoming an Entrepreneur,104760,Self-paced on your time,Massachusetts Institute of Technology,Introductory,Business & Management,English,English,1–3 hours per week,6 Weeks,69.0
"Religion, Conflict and Peace",74060,Self-paced on your time,Harvard University,Introductory,Humanities,English,English,4–8 hours per week,8 Weeks,49.0
"Tangible Things: Discovering History Through Artworks, Artifacts, Scientific Specimens, and the Stuff Around You",61139,Self-paced on your time,Harvard University,Introductory,Humanities,English,English,1–3 hours per week,10 Weeks,49.0
Academic and Business Writing,322701,Self-paced on your time,"University of California, Berkeley",Introductory,Communication,English,English,3–5 hours per week,6 Weeks,49.0
Data Science: Capstone,62803,Self-paced on your time,Harvard University,Introductory,Data Analysis & Statistics,English,English,15–20 hours per week,2 Weeks,99.0
Basics of Computing and Programming,37045,Self-paced on your time,New York University,Introductory,Computer Science,English,English,6–8 hours per week,9 Weeks,200.0
"Fundamentals of Neuroscience, Part 2: Neurons and Networks",84874,Self-paced on your time,Harvard University,Introductory,Biology & Life Sciences,English,English,3–5 hours per week,6 Weeks,99.0
Successful Negotiation: Essential Strategies and Skills,31369,Self-paced on your time,The University of Michigan,Introductory,Business & Management,English,English,2–4 hours per week,7 Weeks,49.0
Data Science: Linear Regression,75310,Self-paced on your time,Harvard University,Introductory,Data Analysis & Statistics,English,English,1–2 hours per week,8 Weeks,49.0
HTML5 and CSS Fundamentals,335895,Self-paced on your time,The World Wide Web Consortium (W3C),Introductory,Computer Science,English,English,4–6 hours per week,6 Weeks,199.0
Data Science: Productivity Tools,66683,Self-paced on your time,Harvard University,Introductory,Data Analysis & Statistics,English,English,1–2 hours per week,8 Weeks,49.0
Introduction to Corporate Finance,98093,Self-paced on your time,Columbia University,Introductory,Business & Management,English,English,3–4 hours per week,4 Weeks,225.0
Computer Science 101,39540,Self-paced on your time,Stanford University,Introductory,Computer Science,English,English,4–6 hours per week,6 Weeks,149.0
Data Science: Wrangling,64584,Self-paced on your time,Harvard University,Introductory,Data Analysis & Statistics,English,English,1–2 hours per week,8 Weeks,49.0
A Hands-on Introduction to Engineering Simulations,187138,Self-paced on your time,Cornell University,Intermediate,Engineering,English,English,4–6 hours per week,6 Weeks,199.0
AI for Everyone: Master the Basics,49340,Self-paced on your time,IBM,Introductory,Computer Science,English,English,1–2 hours per week,4 Weeks,49.0
The Psychology of Criminal Justice,110086,Self-paced on your time,The University of Queensland,Introductory,Humanities,English,English,1–2 hours per week,8 Weeks,99.0
Machine Learning with Python: A Practical Introduction,80161,Self-paced on your time,IBM,Introductory,Data Analysis & Statistics,English,English,4–6 hours per week,5 Weeks,39.0
Analyzing Data with Python,94079,Self-paced on your time,IBM,Introductory,Data Analysis & Statistics,English,English,2–4 hours per week,5 Weeks,39.0
Excel: gestión de datos,111785,Self-paced on your time,Universitat Politècnica de Valencia,Intermediate,Computer Science,Español,Español,4–6 hours per week,6 Weeks,75.0
Probability - The Science of Uncertainty and Data,205615,Instructor-led on a course schedule,Massachusetts Institute of Technology,Advanced,Data Analysis & Statistics,English,English,10–14 hours per week,16 Weeks,300.0
"Fundamentals of Neuroscience, Part 3: The Brain",85034,Self-paced on your time,Harvard University,Introductory,Biology & Life Sciences,English,English,3–5 hours per week,8 Weeks,99.0
Sikhism Through Its Scriptures,44125,Self-paced on your time,Harvard University,Introductory,Humanities,English,English,5–10 hours per week,4 Weeks,99.0
Upper-Intermediate English: Business and Modern Life,77991,Self-paced on your time,Universitat Politècnica de Valencia,Intermediate,Language,English,English,3–5 hours per week,4 Weeks,50.0
Introduction to Probability,97291,Self-paced on your time,Harvard University,Intermediate,Data Analysis & Statistics,English,English,5–10 hours per week,10 Weeks,99.0
Religious Literacy: Traditions and Scriptures,96972,Self-paced on your time,Harvard University,Introductory,Humanities,English,English,5–10 hours per week,4 Weeks,99.0
Programación para todos (empezando con Python),81004,Self-paced on your time,The University of Michigan,Introductory,Computer Science,Español,Español,2–4 hours per week,7 Weeks,49.0
Analyzing and Visualizing Data with Power BI,28879,Self-paced on your time,Davidson College,Introductory,Data Analysis & Statistics,English,English,10–20 hours per week,4 Weeks,99.0
High-Dimensional Data Analysis,78443,Self-paced on your time,Harvard University,Advanced,Data Analysis & Statistics,English,English,2–4 hours per week,4 Weeks,149.0
Introduction To Music Theory,67029,Self-paced on your time,Berklee College of Music,Introductory,Humanities,English,English,3–5 hours per week,6 Weeks,49.0
Human Anatomy,126850,Self-paced on your time,The Hong Kong Polytechnic University,Introductory,Medicine,English,English,2–4 hours per week,8 Weeks,139.0
"CitiesX: The Past, Present and Future of Urban Life",76874,Self-paced on your time,Harvard University,Introductory,Social Sciences,English,"English, Português",5–7 hours per week,11 Weeks,99.0
The Path to Happiness: What Chinese Philosophy Teaches us about the Good Life,24208,Self-paced on your time,Harvard University,Introductory,Philosophy & Ethics,English,English,1–2 hours per week,13 Weeks,99.0
Entrepreneurship 101: Who is your customer?,41838,Self-paced on your time,Massachusetts Institute of Technology,Introductory,Business & Management,English,English,2–4 hours per week,10 Weeks,49.0
"U.S. Public Policy: Social, Economic, and Foreign Policies",44045,Self-paced on your time,Harvard University,Introductory,Social Sciences,English,English,2–4 hours per week,4 Weeks,49.0
Machine Learning with Python: from Linear Models to Deep Learning,85561,Instructor-led on a course schedule,Massachusetts Institute of Technology,Advanced,Computer Science,English,English,10–14 hours per week,15 Weeks,300.0
Introduction to Data Science,43766,Self-paced on your time,IBM,Introductory,Data Analysis & Statistics,English,English,3–6 hours per week,6 Weeks,39.0
Circuits and Electronics 1: Basic Circuit Analysis,52639,Self-paced on your time,Massachusetts Institute of Technology,Introductory,Electronics,English,"English, 中文",5–7 hours per week,5 Weeks,169.0
Introduction to Investments,91788,Self-paced on your time,Indian Institute of Management Bangalore,Intermediate,Business & Management,English,English,3–5 hours per week,5 Weeks,50.0
Improving Your Business Through a Culture of Health,54136,Self-paced on your time,Harvard University,Introductory,Business & Management,English,English,1–3 hours per week,9 Weeks,99.0
Introduction to Linear Models and Matrix Algebra,92004,Self-paced on your time,Harvard University,Intermediate,Math,English,English,2–4 hours per week,4 Weeks,149.0
DO Your Venture: Entrepreneurship For Everyone,61989,Self-paced on your time,Indian Institute of Management Bangalore,Introductory,Business & Management,English,"English, हिन्दी",3–4 hours per week,6 Weeks,150.0
El valor de la creatividad y la innovación: La Economía Naranja,23728,Self-paced on your time,Inter-American Development Bank,Introductory,Art & Culture,Español,Español,2–4 hours per week,8 Weeks,25.0
Humanitarian Response to Conflict and Disaster,119891,Self-paced on your time,Harvard University,Introductory,Health & Safety,English,English,3–4 hours per week,5 Weeks,99.0
"Women Making History: Ten Objects, Many Stories",38939,Self-paced on your time,Harvard University,Introductory,History,English,English,2–3 hours per week,8 Weeks,99.0
Masterpieces of World Literature,88789,Self-paced on your time,Harvard University,Introductory,Literature,English,English,5–7 hours per week,12 Weeks,149.0
SQL for Data Science,39184,Self-paced on your time,IBM,Introductory,Data Analysis & Statistics,English,English,2–4 hours per week,4 Weeks,39.0
El cerebro y las emociones en el lenguaje,41279,Self-paced on your time,Universidad del Rosario,Introductory,Communication,Español,Español,4–5 hours per week,5 Weeks,49.0
Science & Cooking: From Haute Cuisine to Soft Matter Science (physics),62673,Self-paced on your time,Harvard University,Introductory,Physics,English,English,2–3 hours per week,16 Weeks,169.0
Python: aprender a programar,21613,Self-paced on your time,Universitat Politècnica de Valencia,Introductory,Computer Science,Español,Español,3–4 hours per week,8 Weeks,49.0
Marketing Analytics: Competitive Analysis and Market Segmentation,70682,Self-paced on your time,"University of California, Berkeley",Intermediate,Computer Science,English,English,5–7 hours per week,4 Weeks,249.0
MalariaX: Defeating Malaria from the Genes to the Globe,37598,Self-paced on your time,Harvard University,Intermediate,Biology & Life Sciences,English,"English, Français",3–5 hours per week,8 Weeks,49.0
Entrepreneurship in Emerging Economies,113602,Self-paced on your time,Harvard University,Introductory,Business & Management,English,English,3–5 hours per week,6 Weeks,125.0
JavaScript Introduction,160112,Self-paced on your time,The World Wide Web Consortium (W3C),Introductory,Computer Science,English,English,6–8 hours per week,5 Weeks,199.0
People Management,113592,Self-paced on your time,Indian Institute of Management Bangalore,Introductory,Business & Management,English,"English, हिन्दी",2–4 hours per week,6 Weeks,150.0
Using Email for Networking in English,57208,Self-paced on your time,University of Washington,Introductory,Language,English,English,3–5 hours per week,4 Weeks,149.0
Databases: Relational Databases and SQL,20502,Self-paced on your time,Stanford University,Introductory,Computer Science,English,English,8–10 hours per week,2 Weeks,50.0
C Programming: Getting Started,104108,Self-paced on your time,Dartmouth_IMTx-Dartmouth College-IMT,Introductory,Computer Science,English,English,2–4 hours per week,7 Weeks,49.0
Supply Chain Analytics,145049,Instructor-led on a course schedule,Massachusetts Institute of Technology,Introductory,Business & Management,English,English,8–12 hours per week,15 Weeks,199.0
Programming for the Web with JavaScript,91406,Self-paced on your time,University of Pennsylvania,Intermediate,Computer Science,English,English,6–8 hours per week,4 Weeks,149.0
Introduction to Digital Humanities,37501,Self-paced on your time,Harvard University,Introductory,Humanities,English,English,2–4 hours per week,7 Weeks,99.0
Upper-Intermediate English: Business and Industry,103704,Self-paced on your time,Universitat Politècnica de Valencia,Intermediate,Language,English,English,3–5 hours per week,4 Weeks,50.0
EmSAT English Preparation - Level 1,29101,Self-paced on your time,United Arab Emirates University,Introductory,Language,English,English,2–3 hours per week,6 Weeks,49.0
Python for Data Science,266978,Self-paced on your time,"The University of California, San Diego",Advanced,Data Analysis & Statistics,English,English,8–10 hours per week,10 Weeks,350.0
Empathy and Emotional Intelligence at Work,45867,Self-paced on your time,"University of California, Berkeley",Introductory,Business & Management,English,English,1–2 hours per week,4 Weeks,199.0
Design Thinking and Creativity for Innovation,47549,Self-paced on your time,The University of Queensland,Intermediate,Business & Management,English,English,8–10 hours per week,10 Weeks,5.0
China and Communism,69104,Self-paced on your time,Harvard University,Introductory,History,English,"English, 中文",1–3 hours per week,15 Weeks,139.0
Mandarin Chinese Level 1,56040,Self-paced on your time,MandarinX,Introductory,Language,English,English,4–10 hours per week,6 Weeks,149.0
Introduction to Biology - The Secret of Life,147512,Instructor-led on a course schedule,Massachusetts Institute of Technology,Introductory,Biology & Life Sciences,English,"English, 中文",5–10 hours per week,16 Weeks,150.0
Photoshop: una herramienta para presentaciones innovadoras,22969,Self-paced on your time,Pontificia Universidad Javeriana,Introductory,Art & Culture,Español,Español,8–10 hours per week,5 Weeks,19.0
Causal Diagrams: Draw Your Assumptions Before Your Conclusions,50949,Self-paced on your time,Harvard University,Introductory,Data Analysis & Statistics,English,English,2–3 hours per week,9 Weeks,99.0
生活英语听说 | Conversational English Skills,301585,Self-paced on your time,Tsinghua University,Introductory,Communication,English,English,2–4 hours per week,10 Weeks,49.0
Shakespeare’s Othello: The Moor,31868,Self-paced on your time,Harvard University,Introductory,Humanities,English,English,5–7 hours per week,4 Weeks,49.0
