title,n_enrolled,course_type,institution,Level,subject,language,subtitles,course_effort,course_length,price_numeric
Calculus Applied!,54976,Self-paced on your time,Harvard University,Intermediate,Math,English,English,3–6 hours per week,10 Weeks,99.0
Precalculus,55576,Self-paced on your time,Arizona State University,Intermediate,Math,English,English,9–10 hours per week,15 Weeks,49.0
Fundamentos de anatomía y técnica quirúrgica básica,12133,Instructor-led on a course schedule,Universidad del Rosario,Introductory,Medicine,Español,Español,4–6 hours per week,4 Weeks,49.0
Business Communications,60713,Self-paced on your time,University of British Columbia,Introductory,Business & Management,English,English,3–5 hours per week,6 Weeks,150.0
Italian Language and Culture: Intermediate (2019-2020),35058,Self-paced on your time,Wellesley College,Intermediate,Language,Italiano,Italiano,3–5 hours per week,12 Weeks,49.0
International Women's Health and Human Rights,9796,Self-paced on your time,Stanford University,Introductory,Social Sciences,English,English,1–5 hours per week,10 Weeks,50.0
Blockchain: Understanding Its Uses and Implications,66769,Self-paced on your time,The Linux Foundation,Introductory,Business & Management,English,English,2–3 hours per week,14 Weeks,199.0
"A-level Mathematics for Year 12 - Course 1: Algebraic Methods, Graphs and Applied Mathematics Methods",22366,Self-paced on your time,Imperial College London,Intermediate,Math,English,English,2–4 hours per week,7 Weeks,49.0
Blockchain Technology,55376,Self-paced on your time,"University of California, Berkeley",Intermediate,Computer Science,English,English,3–5 hours per week,6 Weeks,99.0
Basics of Power BI,8314,Self-paced on your time,Rolls-Royce,Introductory,Data Analysis & Statistics,English,English,1–5 hours per week,2 Weeks,49.0
Preparing to Network in English,34337,Self-paced on your time,University of Washington,Introductory,Language,English,English,3–5 hours per week,6 Weeks,149.0
Mandarin Chinese Essentials,36665,Self-paced on your time,MandarinX,Introductory,Language,English,English,4–10 hours per week,5 Weeks,99.0
Human Rights: The Rights of Refugees,84270,Self-paced on your time,Amnesty International,Introductory,Humanities,English,English,3–5 hours per week,3 Weeks,49.0
What do Architects and Urban Planners do?,11046,Self-paced on your time,Wits University,Introductory,Architecture,English,English,2–3 hours per week,3 Weeks,49.0
"U.S. Political Institutions: Congress, Presidency, Courts, and Bureaucracy",22723,Self-paced on your time,Harvard University,Introductory,Social Sciences,English,English,2–4 hours per week,4 Weeks,49.0
Negotiation Skills and Effective Communication,8146,Self-paced on your time,Tecnológico de Monterrey,Intermediate,Business & Management,English,English,5–8 hours per week,4 Weeks,149.0
AP® English Literature & Composition – Part 1: Stories,15650,Self-paced on your time,"University of California, Berkeley",Introductory,Humanities,English,English,4–5 hours per week,7 Weeks,49.0
"Viruses & How to Beat Them: Cells, Immunity, Vaccines",28710,Self-paced on your time,IsraelX-Tel Aviv University,Introductory,Medicine,English,English,2–3 hours per week,7 Weeks,149.0
Alianzas: un vehículo para lograr el desarrollo sostenible,17554,Self-paced on your time,Inter-American Development Bank,Introductory,Social Sciences,Español,English,3–4 hours per week,10 Weeks,25.0
Designing and Creating Skirts,13954,Self-paced on your time,The Hong Kong Polytechnic University,Introductory,Design,English,English,3–5 hours per week,5 Weeks,99.0
Cómo Aprender Online,7958,Self-paced on your time,edX,Introductory,Education & Teacher Training,Español,"English, Español",2–3 hours per week,2 Weeks,49.0
Computing in Python II: Control Structures,31511,Self-paced on your time,The Georgia Institute of Technology,Introductory,Computer Science,English,English,9–10 hours per week,5 Weeks,99.0
Facebook Ads: Cómo utilizar el poder de la publicidad en Facebook,29614,Self-paced on your time,Universidad Galileo,Introductory,Communication,Español,Español,3–4 hours per week,5 Weeks,49.0
Machine Learning Fundamentals,82008,Self-paced on your time,"The University of California, San Diego",Advanced,Data Analysis & Statistics,English,English,8–10 hours per week,10 Weeks,350.0
Pre-University Calculus,103224,Self-paced on your time,Delft University of Technology,Introductory,Math,English,English,6–8 hours per week,8 Weeks,50.0
Tsinghua Chinese: Start Talking with 1.3 Billion People,58834,Self-paced on your time,Tsinghua University,Introductory,Language,English,English,2–3 hours per week,6 Weeks,49.0
Deep Learning with Python and PyTorch,36195,Self-paced on your time,IBM,Intermediate,Data Analysis & Statistics,English,English,2–4 hours per week,6 Weeks,99.0
Diseña presentaciones eficaces con Powerpoint,36663,Self-paced on your time,Universitat Politècnica de Valencia,Introductory,Computer Science,Español,Español,4–10 hours per week,3 Weeks,50.0
World of Wine: From Grape to Glass,81839,Self-paced on your time,University of Adelaide,Introductory,Science,English,English,2–3 hours per week,6 Weeks,199.0
Sustainable Cities,16619,Self-paced on your time,SDG Academy,Intermediate,Environmental Studies,English,"English, हिन्दी",4–6 hours per week,9 Weeks,49.0
Introduction to Developmental Psychology,38060,Self-paced on your time,The University of Queensland,Introductory,Humanities,English,English,1–2 hours per week,8 Weeks,99.0
Creativity & Entrepreneurship,69413,Self-paced on your time,Berklee College of Music,Introductory,Business & Management,English,English,3–5 hours per week,4 Weeks,49.0
College Algebra and Problem Solving,103010,Self-paced on your time,Arizona State University,Introductory,Math,English,English,8–9 hours per week,15 Weeks,49.0
Academic writing for clarity and meaning,16220,Self-paced on your time,Wits University,Introductory,Education & Teacher Training,English,English,2–3 hours per week,2 Weeks,49.0
Financial Development and Financial Inclusion,13853,Self-paced on your time,The International Monetary Fund,Intermediate,Economics & Finance,English,English,8–10 hours per week,7 Weeks,25.0
Global Public Health,17273,Self-paced on your time,SDG Academy,Intermediate,Health & Safety,English,English,4–6 hours per week,10 Weeks,49.0
Embedded Systems - Shape The World: Microcontroller Input/Output,69182,Self-paced on your time,The University of Texas at Austin,Intermediate,Computer Science,English,English,8–10 hours per week,8 Weeks,49.0
Introduction to Animal Behaviour,42135,Self-paced on your time,Wageningen University & Research,Introductory,Biology & Life Sciences,English,English,4–6 hours per week,6 Weeks,49.0
Circular Economy: An Introduction,50240,Self-paced on your time,Delft University of Technology,Introductory,Business & Management,English,English,3–6 hours per week,7 Weeks,50.0
Public Financial Management,23288,Self-paced on your time,The International Monetary Fund,Intermediate,Economics & Finance,English,English,4–6 hours per week,8 Weeks,25.0
Anatomy: Human Neuroanatomy,49319,Self-paced on your time,The University of Michigan,Introductory,Biology & Life Sciences,English,English,3–4 hours per week,8 Weeks,49.0
Android: Introducción a la Programación,85786,Self-paced on your time,Universitat Politècnica de Valencia,Introductory,Computer Science,Español,Español,4–5 hours per week,10 Weeks,50.0
The Ancient Greek Hero,51744,Instructor-led on a course schedule,Harvard University,Introductory,Humanities,English,English,8–12 hours per week,18 Weeks,99.0
Agile Leadership Principles and Practices,31838,Self-paced on your time,"The University of Maryland, College Park-University System of Maryland",Advanced,Engineering,English,English,2–3 hours per week,4 Weeks,199.0
How to Code: Simple Data,98113,Self-paced on your time,University of British Columbia,Introductory,Computer Science,English,English,2–3 hours per week,7 Weeks,125.0
Cybersecurity and Privacy in the IoT,21440,Self-paced on your time,Curtin University,Introductory,Computer Science,English,English,4–6 hours per week,5 Weeks,199.0
Strategic Management,71085,Self-paced on your time,Indian Institute of Management Bangalore,Introductory,Business & Management,English,"English, हिन्दी",3–5 hours per week,5 Weeks,150.0
Introducción a la ciencia de datos y sus aplicaciones,7303,Self-paced on your time,IBM,Introductory,Data Analysis & Statistics,Español,Español,3–6 hours per week,6 Weeks,39.0
"Biochemistry: Biomolecules, Methods, and Mechanisms",18692,Instructor-led on a course schedule,Massachusetts Institute of Technology,Intermediate,Biology & Life Sciences,English,English,3–6 hours per week,12 Weeks,150.0
Astronomía Virtual,10500,Self-paced on your time,Universidad Nacional de Córdoba,Introductory,Science,Español,"English, Español",5–7 hours per week,7 Weeks,29.0
Nutrition and Cancer,27144,Self-paced on your time,Wageningen University & Research,Intermediate,Food & Nutrition,English,English,6–8 hours per week,5 Weeks,99.0
Build your very first iOS app,31570,Instructor-led on a course schedule,Curtin University,Introductory,Computer Science,English,English,8–10 hours per week,8 Weeks,149.0
Object-Oriented Programming,93633,Self-paced on your time,IITBombay,Introductory,Computer Science,English,English,6–8 hours per week,4 Weeks,149.0
Introduction to Jenkins,7233,Self-paced on your time,The Linux Foundation,Introductory,Computer Science,English,English,2–3 hours per week,10 Weeks,199.0
Conducting an Informational Interview,15594,Self-paced on your time,University of Washington,Introductory,Language,English,English,3–5 hours per week,8 Weeks,99.0
Liderazgo y comportamiento organizacional,21419,Self-paced on your time,Tecnológico de Monterrey,Introductory,Business & Management,Español,Español,5–8 hours per week,4 Weeks,149.0
Creative Coding,18660,Instructor-led on a course schedule,New York University,Introductory,Design,English,English,8–10 hours per week,14 Weeks,249.0
Análisis estadístico con Excel,22717,Self-paced on your time,Universidad Galileo,Introductory,Data Analysis & Statistics,Español,Español,3–5 hours per week,4 Weeks,49.0
Introducción a la Ingeniería del Software,17931,Self-paced on your time,Universidad Autónoma de Madrid,Introductory,Computer Science,Español,Español,4–5 hours per week,5 Weeks,49.0
Computer Graphics,98553,Self-paced on your time,"The University of California, San Diego",Intermediate,Computer Science,English,"English, 中文",6–12 hours per week,6 Weeks,99.0
Data Science: Computational Thinking with Python,78232,Self-paced on your time,"University of California, Berkeley",Introductory,Computer Science,English,English,4–6 hours per week,5 Weeks,199.0
Comunicación efectiva para el líder actual,18470,Self-paced on your time,Tecnológico de Monterrey,Introductory,Communication,Español,Español,5–8 hours per week,4 Weeks,149.0
Debate y argumentación,10954,Self-paced on your time,Universidad del Rosario,Introductory,Humanities,Español,Español,4–6 hours per week,4 Weeks,49.0
Deep Learning with Tensorflow,37564,Self-paced on your time,IBM,Intermediate,Data Analysis & Statistics,English,English,2–4 hours per week,5 Weeks,99.0
Machine Learning (aprendizaje automático) con Python: una introducción práctica,39155,Self-paced on your time,IBM,Introductory,Computer Science,Español,Español,4–6 hours per week,5 Weeks,49.0
Essential Human Biology: Cells and Tissues,67961,Self-paced on your time,University of Adelaide,Introductory,Medicine,English,English,2–3 hours per week,5 Weeks,169.0
"Writing, Presenting and Submitting Scientific Papers in English | 英文科技论文写作与学术报告",35720,Self-paced on your time,Tsinghua University,Intermediate,Communication,English,English,2–3 hours per week,5 Weeks,49.0
Computing in Python III: Data Structures,27239,Self-paced on your time,The Georgia Institute of Technology,Introductory,Computer Science,English,English,9–10 hours per week,5 Weeks,99.0
Introduction to Internet of Things (IoT),6703,Self-paced on your time,Rolls-Royce,Introductory,Data Analysis & Statistics,English,English,1–5 hours per week,2 Weeks,49.0
Nutrition and Health: Food Risks,51493,Self-paced on your time,Wageningen University & Research,Introductory,Biology & Life Sciences,English,English,6–8 hours per week,8 Weeks,49.0
Mechanics: Kinematics and Dynamics,35529,Self-paced on your time,Massachusetts Institute of Technology,Intermediate,Physics,English,English,10–12 hours per week,12 Weeks,49.0
Storytelling for Social Change,30313,Self-paced on your time,The University of Michigan,Introductory,Communication,English,English,1–3 hours per week,5 Weeks,49.0
Introduction to Data Analytics for Managers,39113,Self-paced on your time,The University of Michigan,Introductory,Business & Management,English,English,2–4 hours per week,6 Weeks,49.0
Qualitative Research Methods: Conversational Interviewing,21972,Self-paced on your time,Massachusetts Institute of Technology,Intermediate,Humanities,English,English,2–3 hours per week,3 Weeks,49.0
International Project Management,45145,Self-paced on your time,Rochester Institute of Technology,Advanced,Business & Management,English,English,8–12 hours per week,9 Weeks,150.0
Software Development Fundamentals,51402,Self-paced on your time,University of Pennsylvania,Intermediate,Computer Science,English,English,6–8 hours per week,4 Weeks,149.0
"First Nights - Stravinsky’s Rite of Spring: Modernism, Ballet, and Riots",17484,Self-paced on your time,Harvard University,Introductory,Humanities,English,English,3–5 hours per week,3 Weeks,49.0
Critical Thinking & Problem Solving,6558,Self-paced on your time,Rochester Institute of Technology,Introductory,Communication,English,English,4–6 hours per week,3 Weeks,199.0
Data Analysis Essentials,42262,Self-paced on your time,Imperial College Business School-Imperial College London,Introductory,Business & Management,English,English,4–6 hours per week,6 Weeks,79.0
Master Control in Supply Chain Management and Logistics,31326,Self-paced on your time,Chalmers University of Technology,Introductory,Business & Management,English,English,4–5 hours per week,7 Weeks,49.0
Work and Employment for a Sustainable Future,6528,Self-paced on your time,SDG Academy,Intermediate,Economics & Finance,English,English,2–4 hours per week,6 Weeks,49.0
Foundations of Data Structures,54075,Self-paced on your time,IITBombay,Intermediate,Computer Science,English,English,6–8 hours per week,6 Weeks,149.0
"Financial Programming and Policies, Part 1: Macroeconomic Accounts & Analysis",31024,Self-paced on your time,The International Monetary Fund,Intermediate,Economics & Finance,English,English,8–10 hours per week,6 Weeks,25.0
IoT System Design: Software and Hardware Integration,13608,Self-paced on your time,Waseda University,Intermediate,Computer Science,English,English,4–6 hours per week,4 Weeks,99.0
English for Doing Business in Asia – Writing,44252,Self-paced on your time,The Hong Kong University of Science and Technology,Introductory,Humanities,English,English,3–4 hours per week,7 Weeks,60.0
Working in Teams: A Practical Guide,43981,Self-paced on your time,The University of Queensland,Introductory,Humanities,English,English,6–8 hours per week,4 Weeks,49.0
Introducción a los encofrados y las cimbras en obra civil y edificación,16029,Self-paced on your time,Universitat Politècnica de Valencia,Introductory,Engineering,Español,Español,2–3 hours per week,4 Weeks,50.0
AI Chatbots without Programming,35440,Self-paced on your time,IBM,Introductory,Computer Science,English,English,2–4 hours per week,2 Weeks,99.0
Introducción a la Ciencia de Datos y el Big Data,16268,Self-paced on your time,Tecnológico de Monterrey,Intermediate,Data Analysis & Statistics,Español,Español,3–5 hours per week,4 Weeks,49.0
Just Money: Banking as if Society Mattered,25553,Self-paced on your time,Massachusetts Institute of Technology,Introductory,Business & Management,English,English,3–4 hours per week,16 Weeks,49.0
Introducción a R,6431,Self-paced on your time,Universidades Anáhuac,Introductory,Data Analysis & Statistics,Español,Español,5–8 hours per week,4 Weeks,49.0
Computing in Python IV: Objects & Algorithms,28112,Self-paced on your time,The Georgia Institute of Technology,Introductory,Computer Science,English,English,9–10 hours per week,5 Weeks,99.0
Adobe Illustrator: aprende a crear presentaciones de impacto,18613,Self-paced on your time,Pontificia Universidad Javeriana,Introductory,Design,Español,Español,9–10 hours per week,5 Weeks,15.0
Teaching Critical Thinking through Art with the National Gallery of Art,18595,Self-paced on your time,The Smithsonian Institution,Introductory,Education & Teacher Training,English,"English, Español, Français, 中文",3–4 hours per week,16 Weeks,25.0
Word intermedio: herramientas de formato y productividad,10265,Self-paced on your time,Universitat Politècnica de Valencia,Intermediate,Computer Science,Español,Español,4–5 hours per week,6 Weeks,50.0
Introducción a las finanzas: Principios de valoración,17344,Self-paced on your time,Universidad del Rosario,Intermediate,Economics & Finance,Español,Español,6–10 hours per week,4 Weeks,49.0
Aprende a diseñar jardines verticales y cuadros vivos,6341,Self-paced on your time,Universidad Nacional de Córdoba,Introductory,Biology & Life Sciences,Español,Español,1–2 hours per week,4 Weeks,29.0
"Anatomy: Cardiovascular, Urinary, and Respiratory Systems",36917,Self-paced on your time,The University of Michigan,Introductory,Biology & Life Sciences,English,English,2–3 hours per week,4 Weeks,49.0
Software Engineering: Introduction,35524,Self-paced on your time,University of British Columbia,Advanced,Computer Science,English,English,8–10 hours per week,6 Weeks,125.0
Structure of Materials,13042,Self-paced on your time,Massachusetts Institute of Technology,Intermediate,Engineering,English,English,6–8 hours per week,16 Weeks,150.0
Fundamentos de fotografía documental,13036,Self-paced on your time,Universidad del Rosario,Introductory,Art & Culture,Español,Español,4–6 hours per week,6 Weeks,49.0
AP® Italian Language and Culture (2020-2021),39398,Self-paced on your time,Wellesley College,Advanced,Humanities,Italiano,Italiano,3–8 hours per week,12 Weeks,49.0
Computer Hardware and Operating Systems,9715,Self-paced on your time,New York University,Introductory,Computer Science,English,English,3–5 hours per week,6 Weeks,150.0
Marketing Management,43415,Instructor-led on a course schedule,"The University of Maryland, College Park-University System of Maryland",Advanced,Business & Management,English,English,8–10 hours per week,7 Weeks,214.0
You Can Innovate: User  Innovation & Entrepreneurship,18974,Self-paced on your time,Massachusetts Institute of Technology,Introductory,Business & Management,English,English,2–4 hours per week,10 Weeks,49.0
Analytics in Python,82210,Instructor-led on a course schedule,Columbia University,Intermediate,Business & Management,English,,8–10 hours per week,12 Weeks,249.0
Bases Matemáticas: Álgebra,35811,Self-paced on your time,Universitat Politècnica de Valencia,Introductory,Math,Español,Español,3–4 hours per week,4 Weeks,50.0
HTML5 Apps and Games,86850,Self-paced on your time,The World Wide Web Consortium (W3C),Advanced,Computer Science,English,English,6–8 hours per week,4 Weeks,199.0
MATLAB and Octave for Beginners,68706,Self-paced on your time,École polytechnique fédérale de Lausanne,Introductory,Computer Science,English,English,5–6 hours per week,4 Weeks,139.0
AP Physics 1,43401,Self-paced on your time,Rice University,Introductory,Physics,English,English,3–4 hours per week,18 Weeks,49.0
The Divine Comedy: Dante's Journey to Freedom,12005,Self-paced on your time,Georgetown University,Introductory,Humanities,English,English,9–10 hours per week,8 Weeks,49.0
Linux Basics: The Command Line Interface,32726,Self-paced on your time,Dartmouth_IMTx-Dartmouth College-IMT,Introductory,Computer Science,English,English,3–5 hours per week,7 Weeks,49.0
Entrepreneurial Operations: Launching a Startup,23808,Self-paced on your time,Babson College,Intermediate,Business & Management,English,English,4–6 hours per week,4 Weeks,149.0
Maths Essentials,44642,Self-paced on your time,Imperial College Business School-Imperial College London,Introductory,Business & Management,English,English,2–5 hours per week,6 Weeks,79.0
"Marketing Analytics: Products, Distribution and Sales",50588,Self-paced on your time,"University of California, Berkeley",Intermediate,Computer Science,English,English,5–7 hours per week,4 Weeks,249.0
Marketing Innovative Products and Services,6293,Self-paced on your time,"The University of Maryland, College Park-University System of Maryland",Introductory,Business & Management,English,English,2–3 hours per week,4 Weeks,149.0
Just Reading and Writing in English | 生活英语读写,33303,Self-paced on your time,Tsinghua University,Introductory,Art & Culture,English,English,2–4 hours per week,15 Weeks,149.0
Introduction to Java Programming – Part 1,270376,Self-paced on your time,The Hong Kong University of Science and Technology,Introductory,Computer Science,English,English,3–5 hours per week,5 Weeks,99.0
Comunicación y Redacción Digital,7165,Self-paced on your time,Universidades Anáhuac,Introductory,Communication,Español,Español,3–4 hours per week,4 Weeks,29.0
Monetary Policy Analysis and Forecasting,6616,Self-paced on your time,The International Monetary Fund,Advanced,Economics & Finance,English,English,8–10 hours per week,6 Weeks,25.0
Basic Analytical Chemistry,19010,Self-paced on your time,The University of Tokyo,Introductory,Chemistry,English,English,3–4 hours per week,6 Weeks,49.0
Identifying Entrepreneurial Opportunities,11922,Self-paced on your time,"The University of Maryland, College Park-University System of Maryland",Introductory,Business & Management,English,English,2–3 hours per week,4 Weeks,149.0
"ChinaX Book Club: Five Authors, Five Books, Five Views of China",5855,Self-paced on your time,Harvard University,Introductory,Literature,English,English,1–2 hours per week,5 Weeks,139.0
Astrophysics: Cosmology,83322,Self-paced on your time,Australian National University,Intermediate,Physics,English,English,2–4 hours per week,10 Weeks,50.0
Japanese Culture and Language (I) |日语与日本文化（1）,18489,Self-paced on your time,Tsinghua University,Introductory,Art & Culture,中文,"日本語, 中文",3–5 hours per week,10 Weeks,139.0
COVID-19 Training for Healthcare Workers,5742,Self-paced on your time,Stanford University,Introductory,Medicine,English,English,1–10 hours per week,2 Weeks,10.0
The Rise of Superheroes and Their Impact On Pop Culture,31368,Self-paced on your time,The Smithsonian Institution,Introductory,Humanities,English,English,1–2 hours per week,6 Weeks,50.0
Introduction to Aeronautical Engineering,99971,Self-paced on your time,Delft University of Technology,Introductory,Engineering,English,English,10–12 hours per week,7 Weeks,50.0
Diseño de Jardines,5683,Self-paced on your time,Universidad Nacional de Córdoba,Introductory,Biology & Life Sciences,Español,Español,1–2 hours per week,4 Weeks,29.0
"Introducción al griego clásico: lengua, nombres y mitología",18849,Self-paced on your time,Universidad Autónoma de Madrid,Introductory,Language,Español,Español,4–5 hours per week,5 Weeks,49.0
Deep Learning Fundamentals with Keras,32140,Self-paced on your time,IBM,Intermediate,Data Analysis & Statistics,English,English,2–4 hours per week,5 Weeks,99.0
Existential Well-being Counseling: A Person-centered Experiential Approach,48439,Self-paced on your time,KU Leuven University,Introductory,Humanities,English,English,6–8 hours per week,12 Weeks,49.0
Solid Waste Management,7668,Self-paced on your time,World Bank Group,Introductory,Environmental Studies,English,English,2–3 hours per week,6 Weeks,5.0
Retail Fundamentals,37558,Self-paced on your time,Dartmouth College,Intermediate,Business & Management,English,English,3–5 hours per week,4 Weeks,99.0
Greatest Unsolved Mysteries of the Universe,93965,Self-paced on your time,Australian National University,Intermediate,Physics,English,English,2–4 hours per week,9 Weeks,50.0
"Money Markets, Foreign Exchange and Time Value of Money",12230,Self-paced on your time,NYIF,Introductory,Economics & Finance,English,English,1–2 hours per week,4 Weeks,199.0
Gestión de Contenidos Digitales y Marketing Turístico de Ciudad,14627,Self-paced on your time,Pontificia Universidad Javeriana,Introductory,Communication,Español,Español,9–10 hours per week,4 Weeks,49.0
Designing the User Experience,6416,Self-paced on your time,"The University of Maryland, College Park-University System of Maryland",Introductory,Business & Management,English,English,2–3 hours per week,4 Weeks,199.0
Introduction to Bioconductor,36370,Self-paced on your time,Harvard University,Intermediate,Data Analysis & Statistics,English,English,2–4 hours per week,4 Weeks,149.0
Connected Strategy,10355,Self-paced on your time,The Wharton School of the University of Pennsylvania,Intermediate,Business & Management,English,English,2–4 hours per week,6 Weeks,199.0
Hybrid Vehicles,18294,Instructor-led on a course schedule,Chalmers University of Technology,Advanced,Engineering,English,English,10–20 hours per week,6 Weeks,249.0
First Nights - Handel's Messiah and Baroque Oratorio,18029,Self-paced on your time,Harvard University,Introductory,Humanities,English,English,3–5 hours per week,3 Weeks,49.0
